{
  "schemaVersion": 1,
  "requestedFacts": [
    {"factTypeId": "sapnexus:InventoryAvailabilityFact", "fields": ["availableQuantity"],
     "objectSelectors": [
       {"objectTypeId": "sapnexus:Material", "key": "material", "value": "DEMOA2"}]}
  ],
  "constraints": [], "analysisNodes": [],
  "requestedConclusions": [{"id": "c1", "statement": "stock", "evidenceRequirement": ""}],
  "assumptions": []
}
